{
  "id": "retail_fresh_produce",
  "schema_version": "1.0.0",
  "name": "Commerce de produits frais",
  "i18n_key": "domain.retail_fresh_produce",
  "icon": "leaf",
  "entities": [],
  "actions": {},
  "rbac_roles": ["OWNER", "GERANT", "COMMERCIAL"],
  "abac_rules": [],
  "conflict_strategy": "server_wins"
}
